step,object,x,y,zoom,page,question,answer,alt_text,layer1_button,layer1_content,layer2_button,layer2_content,clip_start,clip_end,loop
paso,objeto,x,y,zoom,pagina,pregunta,respuesta,texto_alt,boton1,contenido1,boton2,contenido2,inicio_clip,fin_clip,bucle
1,img6101,0.5,0.5,1,,Observation,"In this photo, two students are sitting together while eating a meal. One student is holding food toward the camera, while the other is holding a plate and smiling. The scene feels casual, playful, and relaxed. The food is not presented like a formal meal; instead, it appears as part of a spontaneous moment between friends. Their facial expressions and closeness to the camera create a sense of comfort. This observation stood out to me because the moment felt simple, but also emotionally warm.",,,,,,,,
2,img6101,0.5,0.5,1,,Interpretation,"This moment represents friendship, joy, and everyday care. Sharing food is one of the most common ways people build relationships, but it can still carry emotional meaning. At UCSB, where students are often busy, tired, or far from home, eating with a friend can become a form of support. The humor and playfulness in this image show that love does not always have to appear serious. Sometimes love appears as laughter, comfort, and the willingness to enjoy an ordinary moment together.",,,,,,,,
3,img6101,0.5,0.5,1,,Connection to Readings,This observation connects to Unit 2’s concept of love as connection rather than only romance. Catron’s discussion of closeness helps explain why small shared moments can become meaningful. The students in this photo are not just eating food; they are participating in a ritual of friendship. This confirms the idea that love is built through repeated acts of attention and shared experience. It also connects to Arthur C. Brooks’s idea that love can reduce fear because moments like this can make students feel less alone in a competitive university environment.,,,,,,,,
4,img6101,0.5,0.5,1,,Visual Annotations,"1, The shared food becomes a symbol of playfulness, comfort, and friendship.
2, Their smiles suggest emotional ease and joy, showing love as a relaxed everyday experience.
3, The close framing creates intimacy and makes the viewer feel included in the moment.",,,,,,,,